<?xml version="1.0" encoding="UTF-8"?>
<!DOCTYPE etapa SYSTEM "etapa.dtd">
<etapa>
    <nombre>Puçol a Xeraco</nombre>
    <numero>8</numero>
    <longitud_etapa unidad="km">171</longitud_etapa>
    <fecha>2026-04-12</fecha>
    <tiempo_ganador>03:47:06</tiempo_ganador>
    <velocidad_media unidad="km/h">45.178</velocidad_media>
    <desnivel unidad="m">1270</desnivel>

    <lugar_salida>
        <ciudad>Puçol</ciudad>
        <coordenadas>
            <longitud unidad="grados">-0.319709</longitud>
            <latitud unidad="grados">39.588701</latitud>
            <altitud unidad="m">14</altitud>
        </coordenadas>
    </lugar_salida>

    <lugar_meta>
        <ciudad>Xeraco</ciudad>
        <coordenadas>
            <longitud unidad="grados">-0.189943</longitud>
            <latitud unidad="grados">39.038874</latitud>
            <altitud unidad="m">4</altitud>
        </coordenadas>
    </lugar_meta>

    <tipo_etapa>llana</tipo_etapa>

    <referencias>
        <referencia>Ayuntamiento de Puçol - Portal oficial de historia, patrimonio y turismo
            (https://www.pucol.es)</referencia>
        <referencia>Ayuntamiento de Xeraco - Información turística, playas y patrimonio histórico
            (https://www.xeraco.es)</referencia>
        <referencia>Camino del Cid - Guía turística e histórica de las localidades de Puçol y Xeraco
            (https://www.caminodelcid.org)</referencia>
        <referencia>Turismo Comunitat Valenciana - Información de interés y rutas de Puçol y la
            Safor (https://www.comunitatvalenciana.com)</referencia>
    </referencias>

    <galeria_fotografias>
        <fotografia>foto1.jpg</fotografia>
        <fotografia>foto2.jpg</fotografia>
        <fotografia>foto3.jpg</fotografia>
    </galeria_fotografias>

    <galeria_videos>
        <video>video1.mp4</video>
    </galeria_videos>

    <galeria_sonidos>
        <podcast>audio1.mp3</podcast>
    </galeria_sonidos>

    <hitos>
        <puerto_montana categoria="2a">
            <coordenadas>
                <longitud unidad="grados">-0.278576</longitud>
                <latitud unidad="grados">39.002396</latitud>
                <altitud unidad="m">383</altitud>
            </coordenadas>
            <distancia_salida unidad="km">149.0</distancia_salida>
        </puerto_montana>
    </hitos>

    <puntos_anonimos>
        <punto_anonimo>
            <nombre_punto>Masamagrell</nombre_punto>
            <coordenadas>
                <longitud unidad="grados">-0.328728</longitud>
                <latitud unidad="grados">39.567541</latitud>
                <altitud unidad="m">14</altitud>
            </coordenadas>
            <distancia_salida unidad="km">2.5</distancia_salida>
        </punto_anonimo>
        <punto_anonimo>
            <nombre_punto>Albalat dels Sorells</nombre_punto>
            <coordenadas>
                <longitud unidad="grados">-0.342147</longitud>
                <latitud unidad="grados">39.543189</latitud>
                <altitud unidad="m">19</altitud>
            </coordenadas>
            <distancia_salida unidad="km">4.0</distancia_salida>
        </punto_anonimo>
        <punto_anonimo>
            <coordenadas>
                <longitud unidad="grados">-0.343387</longitud>
                <latitud unidad="grados">39.537747</latitud>
                <altitud unidad="m">16</altitud>
            </coordenadas>
            <distancia_salida unidad="km">5.0</distancia_salida>
        </punto_anonimo>
        <punto_anonimo>
            <coordenadas>
                <longitud unidad="grados">-0.347796</longitud>
                <latitud unidad="grados">39.539459</latitud>
                <altitud unidad="m">17</altitud>
            </coordenadas>
            <distancia_salida unidad="km">6.0</distancia_salida>
        </punto_anonimo>
        <punto_anonimo>
            <nombre_punto>Meliana</nombre_punto>
            <coordenadas>
                <longitud unidad="grados">-0.347483</longitud>
                <latitud unidad="grados">39.528498</latitud>
                <altitud unidad="m">13</altitud>
            </coordenadas>
            <distancia_salida unidad="km">8.48</distancia_salida>
        </punto_anonimo>
        <punto_anonimo>
            <coordenadas>
                <longitud unidad="grados">-0.349788</longitud>
                <latitud unidad="grados">39.522412</latitud>
                <altitud unidad="m">8</altitud>
            </coordenadas>
            <distancia_salida unidad="km">10.0</distancia_salida>
        </punto_anonimo>
        <punto_anonimo>
            <coordenadas>
                <longitud unidad="grados">-0.372059</longitud>
                <latitud unidad="grados">39.538672</latitud>
                <altitud unidad="m">27</altitud>
            </coordenadas>
            <distancia_salida unidad="km">14.0</distancia_salida>
        </punto_anonimo>
        <punto_anonimo>
            <nombre_punto>Moncada</nombre_punto>
            <coordenadas>
                <longitud unidad="grados">-0.388910</longitud>
                <latitud unidad="grados">39.548723</latitud>
                <altitud unidad="m">34</altitud>
            </coordenadas>
            <distancia_salida unidad="km">14.2</distancia_salida>
        </punto_anonimo>
        <punto_anonimo>
            <coordenadas>
                <longitud unidad="grados">-0.395811</longitud>
                <latitud unidad="grados">39.597663</latitud>
                <altitud unidad="m">72</altitud>
            </coordenadas>
            <distancia_salida unidad="km">23.0</distancia_salida>
        </punto_anonimo>
        <punto_anonimo>
            <nombre_punto>Náquera</nombre_punto>
            <coordenadas>
                <longitud unidad="grados">-0.429511</longitud>
                <latitud unidad="grados">39.646227</latitud>
                <altitud unidad="m">178</altitud>
            </coordenadas>
            <distancia_salida unidad="km">26.8</distancia_salida>
        </punto_anonimo>
        <punto_anonimo>
            <nombre_punto>Bétera</nombre_punto>
            <coordenadas>
                <longitud unidad="grados">-0.458373</longitud>
                <latitud unidad="grados">39.592804</latitud>
                <altitud unidad="m">91</altitud>
            </coordenadas>
            <distancia_salida unidad="km">33.6</distancia_salida>
        </punto_anonimo>
        <punto_anonimo>
            <nombre_punto>Riba-roja de Túria</nombre_punto>
            <coordenadas>
                <longitud unidad="grados">-0.565530</longitud>
                <latitud unidad="grados">39.547915</latitud>
                <altitud unidad="m">87</altitud>
            </coordenadas>
            <distancia_salida unidad="km">46.5</distancia_salida>
        </punto_anonimo>
        <punto_anonimo>
            <nombre_punto>Cheste</nombre_punto>
            <coordenadas>
                <longitud unidad="grados">-0.691034</longitud>
                <latitud unidad="grados">39.494917</latitud>
                <altitud unidad="m">227</altitud>
            </coordenadas>
            <distancia_salida unidad="km">63.3</distancia_salida>
        </punto_anonimo>
        <punto_anonimo>
            <nombre_punto>Montserrat</nombre_punto>
            <coordenadas>
                <longitud unidad="grados">-0.603141</longitud>
                <latitud unidad="grados">39.357900</latitud>
                <altitud unidad="m">165</altitud>
            </coordenadas>
            <distancia_salida unidad="km">82.9</distancia_salida>
        </punto_anonimo>
        <punto_anonimo>
            <nombre_punto>Carlet</nombre_punto>
            <coordenadas>
                <longitud unidad="grados">-0.522389</longitud>
                <latitud unidad="grados">39.232844</latitud>
                <altitud unidad="m">54</altitud>
            </coordenadas>
            <distancia_salida unidad="km">102.0</distancia_salida>
        </punto_anonimo>
        <punto_anonimo>
            <coordenadas>
                <longitud unidad="grados">-0.472922</longitud>
                <latitud unidad="grados">39.251663</latitud>
                <altitud unidad="m">34</altitud>
            </coordenadas>
            <distancia_salida unidad="km">112.0</distancia_salida>
        </punto_anonimo>
        <punto_anonimo>
            <nombre_punto>Algemesí</nombre_punto>
            <coordenadas>
                <longitud unidad="grados">-0.439449</longitud>
                <latitud unidad="grados">39.195053</latitud>
                <altitud unidad="m">15</altitud>
            </coordenadas>
            <distancia_salida unidad="km">116.0</distancia_salida>
        </punto_anonimo>
        <punto_anonimo>
            <nombre_punto>Alzira</nombre_punto>
            <coordenadas>
                <longitud unidad="grados">-0.437718</longitud>
                <latitud unidad="grados">39.144720</latitud>
                <altitud unidad="m">17</altitud>
            </coordenadas>
            <distancia_salida unidad="km">122.0</distancia_salida>
        </punto_anonimo>
        <punto_anonimo>
            <nombre_punto>Simat de la Valldigna</nombre_punto>
            <coordenadas>
                <longitud unidad="grados">-0.311654</longitud>
                <latitud unidad="grados">39.046010</latitud>
                <altitud unidad="m">49</altitud>
            </coordenadas>
            <distancia_salida unidad="km">139.0</distancia_salida>
        </punto_anonimo>
        <punto_anonimo>
            <coordenadas>
                <longitud unidad="grados">-0.303035</longitud>
                <latitud unidad="grados">39.032900</latitud>
                <altitud unidad="m">99</altitud>
            </coordenadas>
            <distancia_salida unidad="km">140.0</distancia_salida>
        </punto_anonimo>
        <punto_anonimo>
            <nombre_punto>Port de Barx</nombre_punto>
            <coordenadas>